posted_date,occurrence_date,time,city,state,shape,duration,summary
4/4/14,3/31/14,21:00,Celebration,FL,Unknown,2 minutes,Steady orange red light moving east to west very slowly then disappeared.There were several jets in the area-totally different looking.
4/4/14,3/31/14,12:47,Cooper City,FL,Disk,7,Cooper City saucers.
4/4/14,3/27/14,23:30,Lehigh Acres,FL,Unknown,30 seconds,Alien being seen running on foot on the ground.
4/4/14,3/27/14,21:35,Hobe Sound,FL,Light,3 seconds,Orange then red light.
4/4/14,3/25/14,23:35,New Tampa,FL,Light,15 seconds,Fast moving single light over New Tampa.
3/27/14,3/22/14,21:44,Port St. Lucie,FL,Light,5 minutes?,Several red lights traveling from the north west towards the east and north again at 21:44 just above the horizon in Port St Lucie.
3/27/14,3/22/14,10:10,Port St. Lucie,FL,Fireball,8 minutes,Silent fireballs.
3/27/14,3/22/14,01:00,Coral Springs,FL,Circle,15,Coral Springs purple flying object.
3/21/14,3/19/14,21:00,Ormond Beach,FL,Triangle,15 minutes,V-Shaped cloudy object with 6 lights.
3/21/14,3/19/14,02:00,Spring Hill,FL,Light,10+,Bright light with several changing colors over the Gulf of Mexico.
3/21/14,3/19/14,02:00,Lakeland,FL,Triangle,hours,Shape shifting objects all over central Florida Sky.
3/18/14,3/15/14,23:00,Davie,FL,Light,60 seconds,Amber lights over I-75...definitely not an aircraft on approach.
3/18/14,3/13/14,05:00,Orange Park,FL,Changing,15,Bright object comes up from behind trees hovering over the water.
3/18/14,3/12/14,22:20,Sunrise,FL,Light,3 minutes,Blue and Red light over the Everglades.
3/18/14,3/11/14,22:20,Lakeland,FL,Circle,1 minute,Spinning Circle with blueish and whitish lights around it.
3/18/14,3/11/14,21:45,Sunrise,FL,Light,2 minutes,Just very bright light then red then blue then green moving unlike any normal Craft in right angles then gone.
3/18/14,3/10/14,19:30,St. Cloud,FL,Other,1 minute,Loud (house shaking) booms in the area.
3/18/14,3/9/14,22:00,Jupiter,FL,Circle,1 minute,A round orange glowing object moved east to west moving slowly. Larger as it approached and passed my back yard and then moved upward.
3/18/14,3/9/14,21:30,Lakeland,FL,Light,15 minutes,Orange lights across the night sky - a strange and unexplained sighting.
3/18/14,3/9/14,20:00,Sunrise,FL,Light,15,Strange moving light changing color through the sky.
3/18/14,3/8/14,21:25,Tampa,FL,Unknown,3 minutes,7-8 orange lights 3/8/2014 over Tampa.
3/18/14,3/7/14,21:00,Boynton Beach,FL,Oval,15-30 seconds,6 bright orange objects coming from the north to south with 3 in formation for 15-30 seconds.
3/18/14,3/7/14,20:45,Boynton Beach,FL,Light,Less than 10 mins,3 orange round lights traveled north from the southwest making no sound and they stayed together. Then 1 more appeared from same area.
3/18/14,3/4/14,00:30,Port St. Lucie,FL,Diamond,15 minutes,A red and green diamond shaped spacecraft.
3/18/14,3/3/14,20:00,Wellington,FL,Light,10+ minutes,Bright Blue (LED) Floating Light.
3/18/14,3/2/14,19:00,West Palm Beach,FL,Other,2-3 minutes,Blue U shape light moving slow and suddenly speeding up.
3/18/14,3/1/14,21:10,Davie,FL,Disk,4 minutes,Amber Disk Sighted near Ft. Lauderdale International Airport.
3/18/14,3/1/14,19:40,Tampa,FL,Triangle,5 minutes,String of blinking red light aircraft.
3/18/14,3/1/14,00:00,Palm City,FL,Oval,1 minute,Video of bright orange or colored unidentified object in sky.
3/18/14,2/28/14,21:50,Dover,FL,Unknown,5 minutes,Stationary red and green lights flashing low in the sky.
3/18/14,2/28/14,20:24,Davie,FL,Fireball,4,Unidentified multiple fireball crafts that were too close for comfort.
3/18/14,2/2/14,00:00,Wellington,FL,Fireball,45 seconds,Me and my friends saw a giant orange fireball going really fast across the sky.
3/18/14,1/22/14,10:00,Sunrise,FL,Other,2 seconds,Loud boom followed by the ground shaking.
3/18/14,8/15/13,20:30,Orlando,FL,Light,35 minutes,I figure they may have got caught in the hurricane and were fleeing west to get out of the storm.
2/27/14,2/24/14,00:00,Orlando,FL,Triangle,15 minutes,Triangular shaped aircraft followed by helicopter above 535.
2/27/14,2/24/14,00:00,Palm City,FL,Circle,3 minutes,Bright orange light rotating in sky but no sound of an aircraft.
2/27/14,2/22/14,19:15,Boca Raton,FL,Oval,10 minutes,Nine orange oval objects flying above Boca Raton.
2/27/14,2/22/14,17:20,Jacksonville,FL,Rectangle,1,1 rectangular object seen hovering while drifting out of a cloud and after less than one minute went back inside the cloud.
2/27/14,2/21/14,21:00,Orlando,FL,Oval,Several hours,Load booms like thunder but sound like they are coming from underground.
2/27/14,2/21/14,02:30,Daytona Beach,FL,Fireball,3-4 minutes,Fireball Object is recorded on the Daytona Beach Live Cam. It went into the ocean.
2/27/14,2/19/14,00:30,Palm City,FL,Fireball,2 minutes,More than 1 sighting this week.
2/27/14,2/16/14,16:00,Lantana,FL,Other,>1 hour,Hovering over the ocean.
2/27/14,6/12/06,06:45,Pensacola,FL,Other,2 minutes,Huge Sparkling UFO Horizontally Traverses Inside a Cloud While Emitting Light.
2/21/14,2/20/14,21:10,Saint Cloud,FL,Sphere,3 minutes,I was smoking a cigarette in my car and when I finished I began to go inside. On my way to the door I noticed a very bright red light.
2/21/14,2/20/14,20:55,Orlando,FL,Circle,4 minutes,Big bright orange mothership and two smaller crafts.
2/21/14,2/20/14,10:00,Seffner,FL,Other,15,Mysterious loud booms.
2/21/14,2/17/14,13:00,Keaton Beach,FL,Oval,1 minute,Black Drone with highly advanced propulsion system.
2/21/14,2/15/14,19:00,Juno Beach,FL,Fireball,20 minutes,Two hovering parallel lights over ocean.
2/21/14,7/20/80,13:00,Port Saint Lucie,FL,Triangle,~10 minutes,Large triangular craft going east over the Atlantic Ocean.
2/14/14,2/8/14,19:50,Davie,FL,Light,3 minutes,Seven flying lights turned south and climbed into clouds.
2/14/14,2/5/14,17:55,Fort Myers,FL,Other,5 minutes,Large bright U shaped (horseshoe/double tongue fork) looking object falling from the sky.
2/14/14,2/10/12,18:00,Riverview,FL,Light,10 minutes,Two orange lights moving slowly in unison across the sky.
2/7/14,2/1/14,21:00,Middleburg,FL,Unknown,5 minutes,2 object reddish white hovering in the sky.
2/7/14,1/31/14,21:10,Davie,FL,Circle,10 minutes,Fleet of Ornage UFO's crossing into FLL airport aproach pattern.
2/7/14,1/31/14,21:00,Homestead,FL,Formation,2 minutes,Three orange lights in triangular formation seen over South Dade Senior High.
2/7/14,1/28/14,13:24,St. Petersburg,FL,Flash,2 seconds,Bright white flash of light.
2/7/14,1/25/14,22:00,Vero Beach,FL,Other,1 minute,Red/orange object.
1/30/14,1/27/14,04:00,Englewood,FL,Changing,5 seconds,Orangish oval shape that slowly disappeared in sky seen by two friends.
1/30/14,1/25/14,22:00,Vero Beach,FL,Other,40 minutes,The speed that it went from a stand still to moving was fast. We did not here any engine sounds.
1/30/14,1/25/14,20:45,Palm Beach Gardens,FL,Circle,6 minutes,6 Orange Orbs Travel West to East Across the Northern Sky in South Florida.
1/30/14,1/25/14,20:35,Cape Coral,FL,Light,5-10 minutes,Adult male describes witnessing an estimated 20-25 orange lights move across the night sky.
1/24/14,1/23/14,21:45,Vero Beach,FL,Fireball,1 minute,Looks like a fire ball.
1/24/14,1/23/14,21:35,Oviedo,FL,Fireball,3 minutes,Bright orb that accelerated very quickly.
1/24/14,1/22/14,21:15,Hialeah,FL,Light,1 minute,Red light in NW sky appeared to be star but moving Southward and vanished. Not a Shooting star.
1/24/14,1/22/14,19:00,Micco,FL,Circle,20 seconds,Falling circles dance together then leave.
1/24/14,1/22/14,08:45,Lake Panasoffkee,FL,Sphere,15-25 seconds,Dull white sphere moving slowly but steadily through a clear morning sky. Walked away for about 10 sec. When I returned it was gone.
1/24/14,1/21/14,20:15,Clermont,FL,Disk,Continuing,Period fades.
1/24/14,1/19/14,23:00,Riverview,FL,Other,5-10 minutes,Dark undulating bubble or cloud with two hoola hoop type rings on either side standing vertical; muti-colored spinning lights.
1/24/14,1/19/14,12:00,Dania Beach,FL,Rectangle,5 minutes,Huge silver/gold object by I-95 in broad daylight.
1/24/14,1/18/14,20:00,Tampa,FL,Sphere,15 minutes,Orange lights in the sky.
1/24/14,1/17/14,22:30,Naples,FL,Light,10-15 minutes,Orange and white lights traveling across the sky.
1/24/14,1/17/14,02:45,Orlando,FL,Cylinder,5 minutes,Blue cylinder over east Orlando erratic flying/flashing inject.
1/24/14,1/16/14,22:00,Clermont,FL,Unknown,0:10,Flyby of an unknown object creating a very low frequency humming / pulsating sound.
1/24/14,1/16/14,21:25,Loxahatchee,FL,Sphere,5-7 minutes,Round pure white glowing light moving back and forth up and down with speed and movements not capable by any helicopter or plane.
1/24/14,12/31/13,20:00,New Port Richey,FL,Disk,15-20 minutes,Orange balls of light zoomed in are orange pulsating hexagonal shaped discs.
1/16/14,1/15/14,12:00,Tallahassee,FL,Teardrop,5-10 minutes,Multiple roundish or teardrop shape orbs seen during the daytime.
1/16/14,1/12/14,18:30,Palatka,FL,Fireball,7 minutes,Three fireballs moving slowly across sky.
1/16/14,1/11/14,19:20,Boca Raton,FL,Light,5 minutes,Four traveling orange lights in formation slowly dimmed to nothing.
1/10/14,1/9/14,08:10,Tampa,FL,Unknown,5 minutes,Weird brownish manmade looking object in sky.
1/10/14,1/9/14,02:10,Sanford,FL,Unknown,15 minutes,Loud noise heard.
1/10/14,1/6/14,20:30,Cape Coral,FL,Light,3 minutes,Two lights moving rapidly in two circular patterns that intersected.
1/10/14,1/4/14,23:30,Clermont,FL,Triangle,15 seconds,Very low slow triangular craft with bright white lights.
1/10/14,1/4/14,23:00,Fort Myers,FL,Unknown,15 minutes,Red orbs launch one after another.
1/10/14,1/3/14,08:45,Port St. Lucie,FL,Unknown,6 minutes,20 some orange lights traveling across the sky. From west north-west to south east.
1/10/14,1/1/14,00:30,Ocala,FL,Light,~20 minutes,12 slow moving orange lights over 20 minutes period.
1/10/14,1/1/14,00:30,Bradenton,FL,Fireball,5 minutes,I witnessed 2 orange orbs (thought to be flares at the time due to previous fireworks) moving east.
1/10/14,1/1/14,00:15,Oakland Park,FL,Flash,5 seconds,Bright flash of blue light came out of nowhere in the clear night sky.
1/10/14,1/1/14,00:10,Deltona,FL,Circle,20 minutes,Ten orange circles flying across sky.
1/10/14,1/1/14,00:07,Deltona,FL,Sphere,3 minutes,Well we was watching the fireworks outside for new years 1rst 2014 about 12:07 AM we live in Deltona Florida. And we saw this 3 dull.
1/10/14,1/1/14,00:06,Jacksonville,FL,Circle,2 minutes,Round orange extremley fast moving and silent. Traveling west.
1/10/14,12/31/13,23:40,Pinellas park,FL,Light,15 minutes,Many orange and red lights traveling in formation.
1/10/14,12/31/13,23:40,Sarasota,FL,Light,1 minute,4 Strange lights fly across sky in Sarasota 12/31/13 just before midnight.
1/10/14,12/31/13,23:00,Tampa,FL,Sphere,10 minutes,Glowing purple sphere remained stationary and then moved up and down until disappeared below tree line.
1/10/14,12/31/13,22:00,Saint Cloud,FL,Fireball,5 minutes,Flickering fireball with no sound or tail.
1/10/14,12/31/13,20:00,Middleburg,FL,Sphere,7 minutes,4 Red Balls/Speres floating over Clay county Florida.
1/10/14,12/29/13,19:30,Wellington,FL,Sphere,5-10 minutes,30 UFOs.
1/10/14,12/29/13,18:15,Tequesta,FL,Fireball,2 minutes,Orange fireball traveling SW to NE at a constant speed and altitude. Stayed visible till it went out of sight in the NE.
1/10/14,12/29/13,09:02,Orange Heights (near),FL,Other,5 minutes,Strange blinking lights and a huge triangle shaped craft.
1/10/14,12/28/13,22:00,Orlando,FL,Formation,all night,UFO flying in the Orange county sky.
1/10/14,12/28/13,22:00,Orlando,FL,Unknown,15-30 minutes,Peculiar movements of an object with green (and some white) lights.
1/10/14,12/27/13,18:00,Port St. Lucie,FL,Oval,10 minutes,Craft was darting around with no sound.
1/10/14,12/25/13,21:30,Port Richey,FL,Light,5-10 Minutes,Red light or ball at low altitude moving at the speed of a helicopter but with no sound whatsoever.
1/10/14,12/25/13,20:50,Port Charlotte,FL,Sphere,35-40 second,Bright reddish-orange sphere in southern night sky.
1/10/14,12/25/13,20:00,Orlando,FL,Fireball,5 minutes,Very bright fire ball visible moving from north to south at approximately 300 feet above the ground.
1/10/14,12/25/13,20:00,Orlando,FL,Light,10 minutes,Three individual red lights flying over East Orlando.
1/10/14,12/25/13,19:00,New Port Richey,FL,Disk,16 minutes,Pulsating disc turns into a ball of light.
1/10/14,12/25/13,18:00,Sanford,FL,Fireball,5 minutes,My wife and I saw a large fireball in sky on Christmas day just west of Sanford Florida over the Rock Springs run state preserve.
1/10/14,12/25/13,10:00,Coral Springs,FL,Light,10 minutes,Saw 3 orange lights hovering over broward county FL at 10:25pm Christmas eve.
1/10/14,12/25/13,07:00,Port Charlotte,FL,Sphere,~1 minute,Red sphere in SW Florida Sky.
1/10/14,12/25/13,00:45,Miami,FL,Fireball,30 seconds,Two red orange flying orbs seen at about 1am in Miami on 12/25/2013.
1/10/14,12/24/13,21:30,Crestview,FL,Sphere,2:00,Round orange red base sphere silent about 30 feet diameter light was lumenated from object no single light NAV type.
1/10/14,12/19/13,20:00,Venice,FL,Oval,30 minutes,Saw 15 or more red UFO.s over Venice Florida moving over the Gulf of Mexico.
1/10/14,1/31/13,23:30,Naples,FL,Light,30 seconds,Large Ball of orange light with no sound.
1/10/14,1/12/12,15:00,Miami,FL,Egg,1 seconds,My brother was filming half a dozen kids jumping of a bridge while the object flew silently over them heading to Cuba.
12/23/13,12/22/13,21:05,North Palm Beach,FL,Fireball,2 minutes,2 large fireballs traveling SE to NW.
12/23/13,12/22/13,21:00,Jacksonville,FL,Fireball,10 minutes,5 possible meteors traveling in single file.
12/23/13,12/17/13,20:30,Seminole,FL,Changing,9+ minutes,Pear shape fiery orb with black entities ascending and descending from nearby building.
12/23/13,12/17/13,15:09,Port Richey,FL,Unknown,2 minutes,Driving south on US19 at intersection to turn left at Regency Park Blvd. Port Richey FL. There were multiple power lines.
12/23/13,12/17/13,06:50,Aventura,FL,Light,4 minutes,I SAW THREE BIG WHITE LIGHTS MOVING IN A TRIANGLE FORMATION.I TOKE PICTURES.
12/23/13,12/16/13,08:45,Ocoee,FL,Light,15-20 seconds,Ocoee Fl light 10-15seconds size of a penny if held to the sky. Glowed orange and green with 2 second intervals.
12/23/13,12/14/13,21:45,Miami,FL,Light,5 minutes,Flashing light over Miami.
12/23/13,12/14/13,21:35,Wellington,FL,Light,10-20 minutes,17+ Orange balls of light moving from the Southeast to Northwest.
12/23/13,12/14/13,13:30,Floral City,FL,Cigar,20 seconds,Cigar shaped object moving north to south without sound.
12/23/13,12/13/13,19:20,Naples,FL,Light,12-15 seconds,Bright green light zigzags over the Gulf of Mexico.
12/23/13,12/13/13,19:08,Palm Harbor,FL,Light,15 seconds,Huge bright green/blue ball light travel through the sky.
12/23/13,12/13/13,19:00,Largo,FL,Sphere,Second,Bright orb traveling fast spotted 12/13/13 @ about 1900 hrs over home in largo fl falling from me sky heading towards Redington beach.
12/23/13,6/30/12,17:20,Palm Harbor,FL,Fireball,2 minutes,((HOAX??)) Fireball in sky.
12/23/13,6/20/12,17:20,Palm Harbor,FL,Fireball,1 minute,((HOAX??)) It was a fireball shape. It was very quiet but had a faint burning sound. It was very meticulous looking.
12/12/13,12/8/13,20:30,Homosassa,FL,Light,15+ minutes,Unidentified Super Bright Light Ball.
12/12/13,12/7/13,18:30,Miami,FL,Fireball,on minute,Orange fireball flared out to a white dot east to west southern sky.
12/12/13,12/7/13,07:00,Boca Raton,FL,Fireball,2 minutes,Orange fireball or rocket.
12/12/13,12/6/13,22:20,Coral Springs,FL,Unknown,2-3 minutes,4 red lights seen in the clear night sky lined up in order traveling up and disappeared.
12/12/13,12/5/13,21:30,Palm Springs,FL,Circle,1,Orange fire light flying very high and straight in night sky then fades.
12/12/13,12/4/13,19:30,Port Charlotte,FL,Formation,15 seconds,A bunch of pinprick lights quickly moved across the sky.
12/12/13,12/3/13,17:40,Lake Worth,FL,Fireball,3 minutes,Main craft strange plume. Two fireballs split off.
12/12/13,12/2/13,18:00,Titusville,FL,Circle,5 minutes,Observed brilliant white circular light emitting a bright blue lazer like beam from each side.
12/5/13,12/4/13,10:30,Jacksonville,FL,Cigar,10 minutes,Some type of rocket launch.
12/5/13,12/3/13,17:44,Lake Worth,FL,Formation,4-5 minutes,Fiery orange object splits into 3 silver objects.
12/5/13,12/3/13,17:35,Glen St. Mary,FL,Fireball,5 minutes,Fireball in sky with shock wave that was emitted as white orbs appeared.
12/5/13,12/3/13,17:30,Lehigh Acres,FL,Fireball,15 minutes,Comet Like fire ball turned into craft disappeared into cloud the emerged with another craft behind it.
12/5/13,12/3/13,17:30,Lehigh,FL,Fireball,15 minutes,Comet like Fire Ball Turned into craft then there were two then they disappeared.
12/5/13,12/3/13,17:00,Kissimme,FL,Circle,10 minutes,Glowing circular object flaming across the sky leaving glowing white smoke and seen by people playing basketball.
12/5/13,12/3/13,17:00,Gainesville,FL,Light,1-2 minutes,Very strange and interesting.
12/5/13,12/2/13,05:51,Orlando,FL,Fireball,6 minutes,3 dots floating down and dissapearing.
12/2/13,11/30/13,20:45,Royal Palm Beach,FL,Circle,10 minutes,Circular orange dots moving across the sky and then fizzling out.
12/2/13,11/30/13,20:15,Pinellas Park,FL,Flash,4-6 seconds,Fire in the Sky over Mac Dill AFB Tampa Fla. 30 Nov. 2013.
12/2/13,11/30/13,20:00,Jupiter,FL,Unknown,5-8 minutes,A set of blinking lights simply turned around- not in the way an Airplane or Helicopter makes a u-turn.
12/2/13,11/29/13,18:30,Orange Park,FL,Circle,3 minutes,Orange Park Fl 3 minutes pulsating glowing red and orange orb seen by 4 family members.
12/2/13,11/29/13,04:45,Cape Coral,FL,Other,3 hours,Both of us woke up with lost time but what we recal are identical.
12/2/13,11/28/13,22:40,Orlando,FL,Fireball,5 minutes,3 Glowing Orange orbs.
12/2/13,11/28/13,21:50,St. Augustine,FL,Sphere,15-20 minutes,4 strange orbs of light going around in a weird formation above an abnormally shaped cloud.
12/2/13,11/28/13,01:50,Polk City,FL,Sphere,10 seconds,Blue sphere of light flashes on 1-4 and zoomed down.
12/2/13,11/25/13,19:11,Pompano Beach,FL,Triangle,15 minutes,Black triangular object dancing around in the night sky.
12/2/13,11/25/13,17:25,Oviedo,FL,Formation,2 minutes,Very bright green and red formation of light that was stationary and then moved down towards the ground very quickly.
12/2/13,11/24/13,09:00,Okeechobee,FL,Light,~4 minutes,Towards the E one bright light for a little while by itself then other flickering lights came with streaks of light falling from them.
12/2/13,11/23/13,21:45,Palm Habor,FL,Sphere,4 minutes,Silent Orange sphere.
12/2/13,11/23/13,20:30,South Daytona,FL,Sphere,2 minutes,Fire like orb climbing emerging from the west moving east turning to the north.
12/2/13,11/23/13,19:00,Eustis,FL,Circle,45 minutes,Very bright circle of light that did not move for as long as I saw it (about 45 minutes).
12/2/13,11/22/13,22:30,Port Richey,FL,Triangle,5-7 seconds,Dark wing or triangle shaped soundless object flying at low altitude and extreme speed.
12/2/13,11/22/13,22:00,Winter Garden,FL,Light,1 hour,Very bright white light in northwestern sky. White/red light to its lower right side.
12/2/13,11/22/13,00:00,Tampa,FL,Circle,30:00,Glowing hoop.
12/2/13,11/21/13,22:00,Coral Springs,FL,Fireball,5 minutes,Fireballs floating across sky then dissappearing.
12/2/13,8/1/12,00:00,Vero Beach,FL,Triangle,5-7 minutes,Triangle shaped object in sky.
12/2/13,11/28/83,23:00,Lake Okeechoobee,FL,Oval,10 minutes,Pulsating white lighted craft hoverd over us while hunting.
11/20/13,11/17/13,23:24,Orlando,FL,Sphere,20-30 seconds,Green round object moving fast and irregular.
11/20/13,11/17/13,22:02,Vero Beach,FL,Fireball,4 minutes,Fireball in the night sky.
11/20/13,11/16/13,23:55,Jacksonville,FL,Unknown,3 minutes,Three lights were coming together and then the left and right vanished. middle light stayed a moment before vanishing too.
11/20/13,11/16/13,18:20,Fleming Island,FL,Fireball,5-10 minutes,Several bright orange lights moving across sky.
11/20/13,11/15/13,18:20,Ocala,FL,Diamond,5 minutes,Unknown bright lights.
11/20/13,11/13/13,18:00,Fort Myers Beach,FL,Flash,5 seconds,I saw a massive brilliant jade green light flash in the sky above SW Florida near Lovers Key State park.
11/20/13,11/11/13,21:00,New Port Richey,FL,Light,4 minutes,Two bright orange lights hovering low in the sky.
11/20/13,11/10/13,21:45,Havana,FL,Sphere,2-5 seconds,Orange ball of light.
11/11/13,11/9/13,10:20,Clearwater,FL,Unknown,11:00,Long hovering sound.
11/11/13,11/6/13,22:00,Jupiter,FL,Diamond,2-3 minutes,Ball of fire hovering over ocean near Jupiter.
11/11/13,11/3/13,05:30,Orlando,FL,Cylinder,3 minutes,Orange glowing sphere in Orlando.
11/11/13,11/2/13,21:45,Geneva,FL,Circle,3-5 minutes,Strange red lights suspended in air then vanished.
11/11/13,11/2/13,21:00,Aventura,FL,Circle,15 minutes,Viewed 6 circular reddish orange lights rising from ground level to very high altitude.
11/11/13,11/1/13,20:15,Vero Beach,FL,Fireball,5 minutes,Two very bright orange lights hovering and then flying over Florida coast.
11/11/13,10/31/13,06:28,Ocala,FL,Circle,30 minutes,Orange orbs that seperate into three moving extremly fast.
11/11/13,10/29/13,07:28,Fort Lauderdale,FL,Unknown,2 minutes,Very slow object.
11/11/13,10/28/13,22:30,Wellington,FL,Circle,3 minutes,2 bright lights.
11/11/13,10/28/13,22:00,Davie,FL,Unknown,5 minutes,Fireball in the sky that dissipated after a few minutes.
11/11/13,10/27/13,20:00,Merritt Island,FL,Circle,10 minutes,Orange white orbs moving silent.
11/11/13,10/26/13,03:00,Hosford,FL,Light,30 seconds,Lights.
11/11/13,10/9/13,18:45,Clearwater,FL,Unknown,2 minutes,Went outside in backyard looked up saw a beautiful color green and red object flying in the sky about 5 miles out it flew erratically.
11/11/13,12/26/10,00:05,Fort Lauderdale,FL,Other,~5 seconds,Some kind of sonic boom followed by rumble.
11/11/13,7/5/98,02:00,Manasota Key,FL,Formation,~1 hour,Mother ship with smaller ships encircling moving slowly white lights.
11/11/13,6/30/73,02:00,Ocala,FL,Unknown,15-20 minutes,Unknown flying object circled home at high rate of speed creating a vacuum and making a high pitched whistling/whooshing sound.
10/23/13,10/19/13,22:30,Jupiter,FL,Light,5 minutes,2 orange/yellow round lights traveling slowly one after the other from east to west until disappearing into the clouds.
10/23/13,10/19/13,20:45,Orlando,FL,Other,10-15 minutes,4 groups of 2 orange/red boxes of what appeared to be firelike light seen in central Florida.
10/23/13,10/19/13,11:00,Miramar,FL,Light,10 minutes,10 red orbs moving ne then changing to nw while gaining altitude.
10/23/13,10/17/13,21:35,Okeechobee,FL,Light,15 minutes,Bright Red and White pulsing light.
10/14/13,10/13/13,19:47,West Palm Beach,FL,Light,20-25 seconds,Flashing stationery light streaks off.
10/14/13,10/13/13,19:45,Spring Hill,FL,Diamond,4-5 minutes,Five reddish objects in the sky moved from north to southest before going out of sight.
10/14/13,10/11/13,09:05,Palm Beach Gardens,FL,Light,10-15 seconds,Five orange flying objects in the nights sky and no sound.
10/14/13,10/9/13,20:40,Wellington,FL,Other,12 seconds,Flying from west to east.
10/14/13,10/9/13,06:00,Fort Lauderdale,FL,Circle,10,4 orange circle above me.
10/14/13,10/6/13,22:30,Winter Park,FL,Triangle,5 minutes,Boyfriend and I saw triangular craft with bright yellow lights and a low humming sound pass bedroom window twice.
10/14/13,10/6/13,21:00,Lake Placid,FL,Unknown,<1 second,Damn I wish I had been reording the sky.
10/14/13,10/5/13,22:10,DeLand,FL,Light,8-9 minutes,Intensly bright yellowish/orangish light. Very high in the sky. My house is directly below the N flight path for all air traffic.
10/14/13,10/4/13,22:35,Homestead,FL,Formation,10 seconds,An object/formation of object(s) in half moon shape formed by 7 lights too fast for an aircraft and too slow for a meteor.
10/14/13,10/4/13,22:10,Plantation,FL,Sphere,5 minutes,Bright red sphere moving north to south then west very fast and disappeared.
10/3/13,10/1/13,20:00,Tampa,FL,Light,45-60 minutes,Intensely bright light sphere high up in the sky over the Gulf of Mexico.
10/3/13,9/28/13,19:45,Pensacola,FL,Cylinder,5 minutes,3 orange/red upright cylinders moving south then turned west.
9/30/13,9/28/13,22:10,Plantation,FL,Sphere,1min,2 bright white spheres close together no sound moving quickly in unison.
9/30/13,9/26/13,21:15,Interlachen,FL,Light,20 minutes,REALLY BRIGHT ORANGE SLOW MOVING OBJECT SEEN OVER WEST PUTMAN COUNTY FLA.
9/30/13,9/23/13,21:10,Delray Beach,FL,Light,3 minutes,4 Yellow/Orange lights hovering in sky.
9/30/13,9/21/13,20:20,Miami,FL,Light,1 minute,Light moving randonly in air.
9/30/13,9/20/13,21:45,DeLand,FL,Triangle,5 minutes,3 bright orange glowing objects in sky over deland florida moving from east to west in triangular form.
9/30/13,9/18/13,21:50,Clermont,FL,Light,5 minutes,Witnessed 3 separate orange glowing orbs ascending up in the sky in a slant all moving slow not in unison. They came together.
9/30/13,9/12/13,00:26,Tampa,FL,Cross,3 seconds,A cross shaped glowing figure fell at a rapid speed from the sky shortly after midnight.
9/9/13,9/3/13,19:30,West Palm Beach,FL,Sphere,4 minutes,Orange glowing orb seen by 2 people.
9/9/13,8/30/13,21:10,Port St. Lucie,FL,Fireball,10 minutes,Fiery Colored Silent Agile Ball Of Light.
9/9/13,8/29/13,21:15,Port St. Lucie,FL,Fireball,20 minutes,Fiery Colored Silent Agile Ball Of Light.
8/30/13,8/24/13,00:00,Tyndall AFB,FL,Fireball,3 seconds,Bright steady paced light that began to have a dripping effect towards end of sighting.
8/30/13,8/22/13,22:30,Naples,FL,Unknown,5 minutes,Red light no engine sound heard hovering over tree tops.
