posted_date,occurrence_date,time,city,state,shape,duration,summary
11/15/21,11/6/21,20:25,Miramar,FL,Chevron,8 seconds,V-Shaped transparent craft flying over Miramar- dimly lit amber lights.
11/15/21,10/31/21,00:45,Naples,FL,Light,Unknown,Strange swirling light seen in the sky and video recorded by local news service.
11/15/21,10/28/21,19:45,Clearwater,FL,Light,5 minutes,Four orange/red lights flying in formation one minute apart.
11/15/21,11/20/15,16:00,Leesburg,FL,Sphere,30 seconds,I was checking traps in the swamp by my home. I was walking a game trail when went around a big oak tree.
10/19/21,10/10/21,22:05,Jacksonville,FL,Fireball,15 seconds,Saw 4 green fireballs falling close together. They were extremely close like the distance an airplane isafter takeoff/before landing. .
10/19/21,9/27/21,23:09,Miami,FL,Triangle,5 seconds,A triangular-shaped aircraft moved very smoothly from North to South. It had very dim lights on the front 2 sides of the triangle &gt;.
10/19/21,9/14/21,21:00,St. Petersburg,FL,Light,45 seconds,Two lights hovering and interacting in a controlled manner.
8/20/21,8/14/21,21:00,Fort Myers,FL,Triangle,30 minutes,My son calls me outside around 9pm it tells coming outside and look at all these object circling in the sky. The sky was partly cloudy.
8/16/21,8/10/21,22:50,Palm Beach Gardens,FL,Teardrop,At least 2 hours,Object stopped overhead without moving for over 2 hours.
8/16/21,7/22/21,08:00,Punta Gorda,FL,Cylinder,4 hours,Multiple Tic tac shape flying objects in a few hours.
8/16/21,7/16/21,05:40,Homestead,FL,Fireball,1 minute,Silent Ball of Light going at fast speeds.
8/16/21,7/10/21,00:15,Sarasota,FL,Disk,8 days,Many UFOs gathering in the night sky above Sarasota. Noticed 1 on 7/10/2021 and the sky has been full of them since.
8/16/21,6/12/21,00:00,Riverview,FL,Cylinder,6 sec,Object hovering then disappearing as seen from approximately one mile.
8/16/21,4/20/21,06:20,Pompano Beach,FL,Triangle,15 seconds,An unexpected triangular object with light flames surrounding it appeared near my balcony in Florida before heading out to sea.
8/16/21,3/11/21,18:30,Marathon,FL,Sphere,1 hour,Strange craft during sunset in the Florida Keys.
8/16/21,7/20/20,22:00,Marathon,FL,Light,1 minute at a time,Dim lights that appeared every night over Marathon Florida for a week moving mostly erratically than disappearing silently.
7/31/21,6/4/21,22:15,Land O'Lakes,FL,Light,15 minutes,Bright white circle craft that moved in bouncing figure 8 movements and pulsated different colors.
7/31/21,5/30/21,21:12,Jacksonville,FL,Oval,9 minutes,still craft hangs in sky flashing a sequence of three lights then falls out of the sky and vanishes.
7/31/21,1/1/16,23:00,Windermere,FL,Sphere,3-4 seconds,Fast ball of light.
7/31/21,9/28/81,21:30,Longwood,FL,Chevron,15 minutes,Huge Silent Chevron with all white lights surrounded by gas flying slow and low about 100 feet off ground for 15 minutes.
5/20/21,5/11/21,05:03,Atlantic Beach,FL,Unknown,Seems like an hour,I noticed the unidentified bright lights and vertically aligned squared shaped objects moving sporadically as seen on the security cam.
5/20/21,5/2/21,22:50,Clearwater Beach,FL,Formation,00:00:10,Two bright white object moving in high rate of speed and synchronized movements.
4/23/21,4/12/21,22:50,Coral Springs,FL,Oval,3 hours,Orbs zig zagging and circular patterns.
4/23/21,4/4/21,21:12,Port Charlotte,FL,Chevron,20 seconds,Chevron shaped craft with mirrored exterior traveling from sw to new portion of sky 1000ft above ground. Completely silent.
4/23/21,3/10/21,21:00,Cocoa Beach,FL,Sphere,1 minute,Red orb flying south from Cape Canaveral at slow spped then out to sea it flew.
3/31/21,3/25/21,06:20,Apollo Beach,FL,Chevron,Seconds,Saw a chevron shaped object move across the sky from South to North.
3/31/21,5/1/98,14:00,Ocala,FL,Cigar,4 minutes,Cigar shaped UFO turns at 60 degree angle and disappears in to upper sky in a nano (0.001) seconds without any sound.
3/2/21,1/28/21,06:00,odessa,FL,Sphere,5 hrs,Security camera captured a white sphere maintaining a steady altitude for hrs.
3/2/21,1/23/21,20:33,Saint Augustine,FL,Fireball,2,Strange rocket-like fireball from the north headed south without a sound.
1/19/21,1/18/21,20:05,Saint Johns,FL,Light,5 seconds,Strobing white lighted object moving fast with no sound at an estimated 100 feet.
1/19/21,7/5/00,15:00,Cape Canaveral,FL,Triangle,&lt;5 mins,Triangular steel grey craft hovering at top of vehicle bridge in broad daylight.
12/23/20,12/10/20,18:42,Naples,FL,Triangle,3 minutes,Video taped something actting funny in the sky.
12/23/20,12/10/20,18:42,Naples,FL,Triangle,3 minutes,Triangle shape the strip it look to be bounce up sideways and down really fast.
12/23/20,12/7/20,00:00,Jacksonville,FL,Sphere,30 seconds,Saw sphere ufo moving up and down and side to side driving back from airport.
12/23/20,11/26/20,22:00,Saint Petersburg,FL,Light,3 minutes,Bright Red/Orange pulsating orb above the tree line.
12/23/20,11/24/20,21:00,Orlando,FL,Oval,30 seconds,Saw an oval shaped craft emerged in fire.
12/23/20,11/24/20,15:30,Port St. Lucie,FL,Sphere,4 hrs,Light transparent with rings through the center.
12/23/20,11/14/20,08:00,Hernando,FL,Light,1 minute,Onject souring through sky with a quick light flash before it disappeared.
12/23/20,11/1/20,20:00,Riviera Beach,FL,Circle,10 minutes,Yellow light in cloud became an orange circle that sped toward and over us with no sound and left holes in clouds.
12/23/20,10/17/20,20:15,Temple Terrace,FL,Chevron,20 seconds,Sheathed stealth bomber.
12/23/20,9/9/03,03:30,Navarre,FL,Light,15 minutes,3 yellow orbs chasing one another in the sky facing south towards the Gulf of Mexico.
12/23/20,11/12/98,22:00,Cape Canaveral,FL,Light,10-20min.,Glowing orb/circle with ability to hover and move at speeds above those visible by eye.
11/5/20,9/25/20,13:28,Plantation,FL,Disk,60 seconds,Black disc shaped saucer seen flying underneath the clouds then shooting up into sky.
11/5/20,9/25/20,07:00,Lake Alfred,FL,Oval,10 minutes,Pack of lights at sunrise over Legoland Florida area.
11/5/20,9/24/20,23:23,Orlando,FL,Triangle,20 minutes,Huge triangle Shape with flashing lights craft hovering seen from I4 highway.
9/4/20,9/1/20,22:15,Parrish,FL,Fireball,5 seconds,UFO sighting in parrish Florida.
8/27/20,8/20/20,22:00,Satellite Beach,FL,Light,10 minutes,Last night of FL vacation observed a large red object sitting in or near T-storm over ocean near Cape Canaveral.
8/27/20,8/16/20,23:30,Pace,FL,Unknown,5 minutes,Very bright object in eastern sky suddenly disappears while being viewed through binoculars.
8/20/20,8/17/20,01:00,Wedgfield,FL,Light,3.0,Ball of light w multicolor-several sightings.
8/20/20,8/16/20,21:00,Pembroke Pines,FL,Circle,45 minutes,5 star-like objects gliding/flying from Jupiter/Saturn area through the sky. 2 of the same objects coming back directly to Jupiter.
8/20/20,8/14/20,22:00,Pompano Beach,FL,Unknown,Hour,There were four different objects which seemed to be connected to each other in some way.
8/20/20,8/11/20,12:30,Homestead,FL,Triangle,3 minutes,I saw a orange triangular shaped object flying to the west. Just hovering then slow moving. There was a orange orb on each point.
8/20/20,8/5/20,20:43,Sarasota,FL,Oval,Don't know,2 Oval shaped objects in north sky.
8/20/20,1/24/20,00:00,Tampa,FL,Light,10 minutes,I was outside my house with my Boyfriend and I saw a red light in the sky in the same spot for about 10 minutes.
8/6/20,8/6/20,16:00,Dania Beach,FL,Circle,3 minutes,Metallic ball flying.
8/6/20,8/1/20,03:04,Melbourne,FL,Oval,6 minutes,I don't know what this is. If you could conform this video for me that would be great. Thank you.
7/31/20,7/29/20,04:19,Venice,FL,Teardrop,5 minutes,Bright White/Orange teardrop turned starburst light moving slowly before changing directions twice and speeding off.
7/31/20,7/25/20,21:45,West Palm Beach,FL,Light,1 minute?,High-speed stop-n-go alternating lights between big bright meteor intensity to small softer blue.
7/23/20,7/4/20,21:30,Crestview,FL,Fireball,5 minutes,6 UFOs and alien noises in neighborhood.
7/23/20,7/11/05,23:45,Port Saint Lucie,FL,Diamond,1 minute,Two diamond shaped lights in the sky pulsating.
6/25/20,6/25/20,17:00,Tampa,FL,Other,20 seconds,White boomerang shaped craft travelling south to north in a straight line at satellite speed for a very long distance.
6/25/20,6/11/20,12:57,Pensacola,FL,Changing,10 minutes,Strange shaped lighted beings appeared on video camera footage.
6/25/20,5/17/20,05:00,Lake Placid,FL,Light,10 minutes,More than 75 lights moving high up in the sky for more than 10 minutes from the SW to NE. ((Starlink satellites?)).
6/25/20,5/1/20,20:12,Delray Beach,FL,Oval,8 min,Three bright lights followed by a stream of colored vapor.
6/25/20,4/30/20,21:15,Coconut Creek,FL,Formation,Less than a minute,Dots of light in a line formation slowly moved in a southwest upward motion and each disappeared as it looked to be going upward.
6/25/20,4/30/20,21:00,Palm Bay,FL,Light,5 minutes,15 plus lights traveling in perfect straight line. Appeared as bright as a star.
6/25/20,4/30/20,03:15,Clearwater,FL,Other,30 minutes,Got up to 3:15am was attracted to look at a “star like” that suddenly went to a blinding bright envelope of bright light.
6/25/20,4/29/20,19:18,Melbourne,FL,Light,4 minutes,Line of traveling white lights disappear one by one over Melbourne FL.
6/25/20,4/29/20,16:45,Holt,FL,Rectangle,45 seconds,Witnessed oblong metallic object sit motionless in sky for 30 seconds before slowly flying away.
6/25/20,4/29/20,04:15,Frostproof,FL,Light,3 seconds,I saw a very bright very green light descend over Lake Clinch.
6/25/20,4/12/20,22:35,Wellington,FL,Circle,6 seconds,3 big white lights on v shape formation heading south 190. No sound and you can see them through the clouds.
6/25/20,4/7/20,19:30,Boca Raton,FL,Light,30 seconds,Blue Green Oval Light with orange sparks seen streaking in the evening sky.
6/25/20,4/7/20,18:45,Fort Lauderdale,FL,Fireball,10 seconds,While seated looking east from a 10th floor I suddenly saw a large Fireball descend to what appeared to be almost 200 feet in altitude.
6/25/20,12/16/19,16:00,Fort Lauderdale,FL,Light,Outside,Flash of blue lights fly across the sky.
6/25/20,6/20/06,10:30,Jacksonville Beach,FL,Rectangle,30 seconds,Flying rectangle with an irregular flight pattern with green lights.
5/21/20,3/21/20,11:15,New Smyrna Beach,FL,Disk,10 minutes,Bright disc-shaped object that jukes around and then vanishes in blue skies.
5/15/20,3/18/20,20:00,Orlando,FL,Disk,15 minutes,bright light to the west and top of atmosphere. I used my telescope and saw it was a group of craft.
5/7/20,4/8/20,22:44,Boca raton,FL,Fireball,12 minutes,Fireball in the sky. Remained stationary for several minutes.
5/7/20,3/26/20,17:35,Land O'Lakes,FL,Sphere,7,Black Sphere moving south at high rate speed (Multiple Daily Sightings).
4/9/20,4/2/20,07:00,Delray,FL,Cigar,30 seconds,In the air bright white image not seeming to move as I was watching then disappeared.over st road 441 around 7am to 7:15.
4/9/20,3/8/20,23:57,Palm Harbor,FL,Sphere,15 seconds,Looked out my third-floor balcony to see a large round orange light slowly moving east. It continued east and then vanished.
4/9/20,3/4/20,20:00,Dade City,FL,Circle,Hours,Strange bright pulsating light looks like a orange ball inside the light pulsating.
4/9/20,3/19/16,01:00,DeLand,FL,Cone,2 hours,((HOAX??)) We observed a craft covered in orange lights hovering in the lake. There were 2 smaller saucer shaped craft hovering.
2/25/20,2/23/20,16:00,Lake Worth Beach,FL,Light,15 minutes,2 lights off coast of lake worth beach over ocean. Turned black and disappeared into the water or horizon.
2/13/20,2/9/20,07:45,Sarasota,FL,Sphere,1 hour +,Glowing ball of light over West/Southwest sky. Did not move at all. Definitely not Venus.
2/7/20,1/12/20,18:50,Sebastian Inlet,FL,Formation,20 minutes,Nearly 100 Starlike &quot;Lights&quot; moving rapidly in a straight line formation and then disappearing.
2/7/20,1/11/20,01:00,Ponte Vedra Beach,FL,Oval,10 seconds,Large bright blue/ green object traveling at light speed dropped out if the sky and towards the ground and disappeared.
2/7/20,1/9/20,10:30,Dunnellon,FL,Cigar,5 minutes,HUGE OBLONG SHAPED SILVER/METALLIC OBJECT PHOTOGRAPHED OVER DUNNELLON FL.
2/7/20,12/31/19,23:55,Wesley Chapel,FL,Light,30 minutes,8-9 Disc shaped lights moving south about 1000 feet up with no sound.
2/7/20,12/31/19,07:44,St. Augustine,FL,Disk,5 seconds,Saw a very shiny small object in the sky. Hovered for 5 seconds and then disappeared.
1/31/20,10/11/73,18:45,Jupiter,FL,Egg,~4 hours,Egg-shaped object emits light ray and missing time occurs .
12/22/19,7/25/66,14:00,Holly Hill,FL,Disk,15 Min.,In the summer of '66 a UFO was spotted by 3 children ;later a down passenger jet was seen in a vision not sure if the two were related.
12/19/19,12/15/19,12:45,Valrico,FL,Circle,30 seconds,Four circular UFOs spotted over central Florida.
12/19/19,12/2/19,03:00,Jacksonville,FL,Triangle,2-3 minutes,3 circular lights gliding and hovering over NAS Jax. Looked camouflaged and was completely silent.
12/19/19,7/20/19,00:00,Kissimmee,FL,Disk,6 minutes,I saw a big flying round green light shining object flying by my house slowly.
12/1/19,11/22/19,22:35,Brandon,FL,Triangle,10 seconds,3 white bright flashing lights shaped as a triangle with no sound .
12/1/19,11/12/19,21:05,Palm Springs,FL,Light,3-5 minutes,A light like a rocket passed in a NW to SSW arc.
12/1/19,11/12/19,17:30,Brooksville,FL,Circle,1-2 minutes,White circle orb over cow field.
12/1/19,11/11/19,19:00,Blountstown,FL,Cigar,5-10 seconds,Huge object lit by 6 bright lights.
12/1/19,11/11/19,18:28,DeFuniak Springs,FL,Formation,20 seconds,5-6 lights in the same interval floating over the woods with no noise.
12/1/19,11/5/19,01:00,Springhill,FL,Triangle,1 hour,Craft 3 red lights in a triangle hovering for about 2 hours then follows me driving in my car keeping up to me. Then was gone.
12/1/19,10/15/19,21:30,Eustis,FL,Other,3 min,Giant V shaped cloud shot across the sky within seconds.
12/1/19,10/14/19,06:00,Sarasota,FL,Other,30 Seconds,I know what I saw is exactly what the report from Sept 24th from Vero Beach saw.
12/1/19,10/13/19,19:29,Naples,FL,Cone,10 seconds,A bright white light descended rapidly out of a low hanging cloud in an evening sky.
12/1/19,10/11/19,19:30,Ponce de Leon,FL,Unknown,<2 minutes,Unknown aircraft nav-anticollision light configuration.
12/1/19,10/10/19,20:00,Stuart,FL,Triangle,10 seconds,I was trying to take a picture of the moon and didn't realize until later something else was in the photos.
12/1/19,10/6/19,23:00,Boynton Beach,FL,Formation,1-2 seconds,V shape formation of very bright lights flew by at incredible speed.
12/1/19,10/5/19,00:10,Navarre Beach,FL,Circle,20 seconds,Half circle of faintly lit dots that traveled west to east.
12/1/19,8/27/19,20:30,Palm Harbor,FL,Unknown,30 seconds,Two orange lights on each end.
12/1/19,1/19/00,03:00,West Palm Beach,FL,Egg,20 minutes,Grey visitation and abduction.
10/4/19,10/2/19,20:03,North Port,FL,Formation,20 seconds,I just witnessed a ‘Phoenix Lights’ type of formation of UFOs.
10/4/19,10/2/19,19:00,Tampa,FL,Other,6 seconds,Spotted 6 semi translucent lit objects in formation flying at a fast rate with no sound over Tampa heading South.
10/4/19,10/2/19,19:00,Vero Beach,FL,Rectangle,20 seconds,Photographed light anomaly or object within low cloud formation.
10/4/19,9/29/19,20:00,Tampa,FL,Disk,3 minutes,The ufo looked like a flying saucer with cloaking to make it look almost invisible but not quite.
10/4/19,9/27/19,21:30,Bradenton,FL,Light,5 seconds,Observed strange fast moving lights in western sky.
10/4/19,9/25/19,20:30,Venice,FL,Triangle,30-45 seconds,About 8:30 pm I witnessed a large black triangle silently fly NW-SE near the Venice Fl. Airport.
10/4/19,9/25/19,06:29,Deerfield Beach,FL,Light,2 minutes,Two minus one magnitude stars suddenly disappear.
10/4/19,9/21/19,21:30,St. George Island,FL,Unknown,15 minutes,UFO sighted moving toward shore on st George island and then another was seen moving away back over the gulf.
10/4/19,9/10/19,21:00,Fort Myers Beach,FL,Unknown,5 minutes,UFO on beach.
9/6/19,8/30/19,20:15,Orlando,FL,Unknown,3 minutes,2 craft-in trail formation-both-ENGULFED IN FIRE- no sound.
9/6/19,8/25/19,23:17,Bradenton,FL,Fireball,1 minutes,Small fireball traveling over house in a wooded area.
9/6/19,8/25/19,12:00,Key Biscayne,FL,Light,Unknown,Stormy weather and 5 Pink lights in the sky above Miami.
9/6/19,8/11/19,22:15,Panama City,FL,Changing,30 minutes+,Saw what I thought was a weird star then it's straight up and down right to left crazy moves.
8/23/19,8/21/19,00:00,Coco/St. Cloud (between),FL,Cigar,2 minutes,Yellow to white in 2 minutes shot off like a bullet and the sky litt up like the Sun.
8/23/19,8/8/19,07:30,St. Augustine,FL,Circle,10 minutes,Fast moving circular shaped craft.
8/23/19,8/5/19,22:47,Lake City,FL,Light,3 seconds,Fast with momentary light trail.
8/23/19,8/3/19,20:54,Apopka,FL,Disk,15 minutes,Disc stationary in East sky.
8/23/19,8/1/19,23:00,Midway,FL,Unknown,20 seconds,White light (UFO) travelled across the sky then disappeared...
8/23/19,7/28/19,15:30,Orlando,FL,Oval,5 minutes,In direction of daytime moon seen what appeared to be metalic object hovering very high in sky.
8/23/19,7/28/19,02:30,Destin,FL,Light,15 minutes,UFO over Holiday Isle in Destin.
8/23/19,7/27/19,21:40,Largo,FL,Light,15 seconds,2 parallel lights heading NW to SE toward MacDill AFB.
7/25/19,7/20/19,05:30,ZEPHYRHILLS,FL,Light,5 seconds,LIGHTS IN A FORMATION.
7/25/19,12/15/18,20:43,Mulberry,FL,Cylinder,8 minutes,I looked off to the S and noticed a bunch of Lights coming from down low from the S heading to the E and they were making noise.
7/25/19,7/11/18,18:00,Pensacola Beach,FL,Changing,hours,We saw what looked like circular shimmering lights of various colors all around the beach area. They where NOT drowns.
7/12/19,7/6/19,23:17,Canal Point,FL,Other,30 seconds,A flying micro object hovering by my house.
7/12/19,7/4/18,21:00,Shalimar,FL,Light,30,Rising and falling lights.
7/12/19,6/11/18,21:44,Panama City (beach),FL,Light,10,orbs of light rising and falling.
7/5/19,7/3/19,02:15,Champions Gate,FL,Sphere,2 minutes,Two sphere long fire behind it.
6/27/19,6/26/19,22:30,Lake City,FL,Light,180 seconds,Light meandering West to Easy in North Florida.
6/27/19,6/25/19,03:30,Miramar,FL,Fireball,3 minutes,Orange probe like lights.
6/27/19,6/25/19,00:55,Jacksonville,FL,Teardrop,139 seconds,Visitor for the heaves before the Falcon Heavy 9 launch on June 25 2019.
6/27/19,6/22/19,23:50,Middleburg,FL,Sphere,20-25 seconds,Silent red ball of light moving from West to East until out of sight.
6/27/19,6/21/19,23:50,Bradenton,FL,Light,3 minutes,3 lights headed over gulf.
6/27/19,6/20/19,10:30,Orlando,FL,Light,5 seconds,Oval light disappears in sky.
6/20/19,6/17/19,21:14,Marathon,FL,Fireball,20 seconds,1 round Orange Redish Ball. Traveled South to North over Duck Key at a slow speed.
6/20/19,6/17/19,12:15,Naples,FL,Light,30 seconds,2 separate stationary lights hover over Gulf of Mexico.
6/20/19,6/12/19,22:00,Melbourne Beach,FL,Unknown,Hour,2 tiny lights recorded for about a minute. We watched the top light bolt higher and then the lower light does a semi-circle.
6/20/19,6/11/19,21:50,Punta Gorda,FL,Unknown,2 minutes,Was lightning sitting on Lanai. Saw what I thought was a star. I saw lights going left to right in the object in sky.
6/20/19,6/10/19,22:40,Brandon,FL,Light,5 seconds,Orange light flying at low altitude appears and disappears after making U shaped dip down.
6/20/19,6/4/19,05:00,Grant-Valkaria,FL,Changing,4 minutes,Three minute video shows an extremely large cube shaped object that appears to be rotating with a variable flash rate.
6/20/19,3/1/78,10:00,Eglin AFB,FL,Circle,3 hours,Group of USAF cadets and an officer saw a saucer at an air force base.
6/7/19,5/20/19,03:00,Palm Bay,FL,Unknown,2 minutes,Star that wasn't a star.
6/7/19,5/19/19,21:10,Bradenton,FL,Sphere,10 minutes,7 orange spheres flying in formation.
6/7/19,5/17/19,20:25,Fort Myers,FL,Egg,1 hour,Two kyobjects in the s that are always around me.
6/7/19,3/27/19,13:00,Punta Gorda,FL,Disk,20 seconds,Three disc objects flying 30 k ft overhead.
5/9/19,5/7/19,22:00,Palm Coast,FL,Sphere,6 minutes,05/07/19 I saw 2 spheres inside were white sparkling lights lights. A few minutes later they both vanished.
5/9/19,4/26/19,23:00,Basinger,FL,Flash,45 minutes,Saw flashing object for 45 minutes flying in a rough triangle pattern in a very tight pattern flash very bright and then very dim.
4/25/19,4/23/19,12:22,Indian Lake Estates,FL,Oval,10 seconds,Brilliant blue oval shaped object crosses sky directly overhead.
4/25/19,4/22/19,01:11,St. Petersburg,FL,Flash,10 seconds,Quick white flashing streak that turned greenish and fully disappeared into the tree line.
4/25/19,4/15/19,20:00,Orlando,FL,Fireball,5 minute,It was a round bright object.
4/25/19,11/18/17,19:00,Haines City,FL,Changing,5 minutes,Smudge-shaped object that moved across sky and dispersed into hundreds of different colored lights all following a movement pattern.
4/18/19,4/11/19,14:00,Ormond Beach,FL,Formation,5 minutes,Four strange aircraft flying in pairs; bathed in pearl-iridescent color; preceded by loud high pitch whirling sound headed SE.
4/8/19,4/4/19,06:50,Ponte Vedra Beach,FL,Triangle,5 seconds,Green fast moving light in the morning sky.
4/8/19,3/30/19,23:54,Jacksonville,FL,Fireball,1 second,Bright green flash/fireball.
4/8/19,9/7/18,17:45,Port Saint Lucie,FL,Sphere,2 minutes,The craft wanted me to see it.
3/29/19,3/22/19,20:45,Palm Coast,FL,Light,10 seconds,Glowing green lights over beach.
3/29/19,5/21/81,14:30,Pensacola,FL,Disk,20 minutes,Huge Saucer over Pensacola Pass.
3/21/19,3/15/19,18:30,Champions Gate,FL,Circle,3 minutes,The object omitted a beam.
3/15/19,3/14/19,21:30,Palmetto,FL,Formation,2 minutes,Far off in a distance and very high up was a group of lights which looked like stars was bunched up at first and not moving for 30 sec.
3/15/19,3/14/19,20:45,Vero Beach,FL,Formation,15 minutes,I saw a large irregularly shaped cluster of 50-100 moving white lights (star and planet size) and one larger amber shape.
3/14/19,3/14/19,21:00,Fellsmere,FL,Light,10 minutes,A group of us watched one large center light brighter than the surrounding 100 to 200 other light formations in the sky.
3/14/19,3/13/19,00:51,Floridat (southern SW part),FL,Cross,30 plus,Green lights appeared to propel in direction.
3/14/19,3/11/19,22:29,Davie,FL,Light,2 minutes,Yellow/green just hovering over neighbors House. Plane is approaching from the west And it just took off south at lighting speed.
3/14/19,3/11/19,19:30,Key West,FL,Triangle,5 seconds,Transparent triangular shape craft flew across US1 20 mins north of Key West made no sound.
2/14/19,2/7/19,21:41,Fort Myers,FL,Light,19 seconds,Five lights in a V-shape flew over our heads.
2/7/19,2/3/19,23:20,Tampa,FL,Circle,2 minutes,I was outside towards my car. Watching the clear skies tonight i saw 2 circular objects flying high but close enough to see it clearly.
2/7/19,2/1/19,10:00,Flamingo,FL,Circle,90 seconds,I saw a colored object slowly ascending while rotating along a very secluded shoreline in Everglades National Park.
2/1/19,1/29/19,05:35,Clermont,FL,Light,90 seconds,Orange and white lights cruising eastward toward Orlando.
1/11/19,1/5/19,20:24,Port St. Lucie,FL,Light,20 seconds,10-15 lights.
1/11/19,1/4/19,20:30,Palm Beach Gardens,FL,Circle,5 minutes,5-8 reddish orange balls/circles in night sky over Florida.
1/11/19,12/27/94,17:30,Panhandle/Big Bend area,FL,Oval,15 minutes,Huge mothership.
1/4/19,12/31/18,21:41,Ormond Beach,FL,Fireball,20 seconds,Orange glowing object racing though the sky.
1/4/19,12/30/18,20:30,Titusville,FL,Light,5 minutes,10-12 orange lights seen at night on 95 South in Titusville. Within about 5 minutes they changed formation 3 times before disappearing.
1/4/19,12/30/18,00:00,Pensacola,FL,Changing,7 hours,Alien beings just outside my window. Put up a screen like cloth to cloak themselves and there craft. I could see through it and have m.
1/4/19,12/18/18,22:30,St. Augustine,FL,Light,15 seconds,A bright white light flashed and then a green light appeared and floated across the sky until it vanished.
12/14/18,12/6/18,07:30,North Fort Myers,FL,Circle,10 minutes,5orange glowing slow moving lights that come across sky the disappered.. Then min later a few more then few more.
12/6/18,11/26/18,23:26,Perry,FL,Circle,20 minutes plus ??,I noticed two green dots way up in the sky. As we kept driving they got more vivid.
11/24/18,11/14/18,20:38,Cape Coral,FL,Fireball,2 seconds,Green ball shooting through sky and illuminating clouds around it.
11/24/18,11/12/18,00:00,Gulf of Mexico,FL,Changing,5 seconds,Falling object from space.
11/24/18,11/5/18,19:27,Orlando,FL,Triangle,2 minutes,Glowing red object in Orlando sky traveling south to northwest.
11/24/18,11/2/66,11:00,Opa Locka,FL,Oval,3 hours,2 oval shaped ufo’s.
11/9/18,11/7/18,19:00,Fort Myers,FL,Circle,5 minutes,Large Circular Donut-Shaped UFO in Ft Myers Sky.
10/25/18,10/21/18,00:15,Palm Coast,FL,Chevron,6 seconds,Three boomerang shaped objects with a faint amber glow moved silently in a southerly direction.
10/12/18,10/12/18,02:55,Cape Coral,FL,Oval,6-8 seconds,Looking up the night was cloudy when I saw a light blue circular object with a long tail and a shorter stretch in the front.
10/6/18,9/28/18,06:00,Naples,FL,Sphere,ongoing til dawn,1 spherical shaped UFO with red/green/white lights. Always seen early in the am in the same spot.
10/6/18,9/27/18,18:50,Sebastian,FL,Unknown,5 minutes,Object falling from the sky with white trail of smoke.
10/6/18,3/11/18,19:45,Tampa,FL,Light,0:44,Very bright disk light object at a dead stop in the sky signals then zooms away.
